-7,-6,-5,-4,-3,-2,-1,0,1,2,3,4,5,6,7
NA,NA,NA,NA,NA,NA,"Einige harmlosere Verbrechen (wie Diebstahl) begehen, um den Nervenkitzel zu erleben.","Bekannten Menschen aus dem Weg gehen, weil sie sich nicht an unser Treffen erinnern werden.",Eine Karriere als Wahrsager/in aufbauen.,NA,NA,NA,NA,NA,NA
NA,NA,NA,NA,NA,"Anderen Leuten Fragen stellen, die ich mich sonst nicht getraut hätte zu fragen.",Nackt in der Gegend rumlaufen.,"Die Zeit nutzen, eine neue Fähigkeit zu lernen oder mich darin zu verbessern.",Meinen Alltag ganz normal weiterleben.,"Haarsträubende Lügen erzählen, um zu sehen, ob ich damit durchkomme.",NA,NA,NA,NA,NA
NA,NA,NA,NA,"Tun was ich möchte, ohne Rücksicht auf Andere.","Allen Leuten sagen, was ich wirklich über sie denke.","Mir ein Tattoo stechen lassen, um zu sehen, ob es mir gefällt.",Neue Restaurants ausprobieren.,"Menschen kennenlernen, ohne schüchtern zu sein.",Eine riesige Party schmeißen.,"Alles aufs Spiel setzen, um ein wichtiges Geheimnis zu lüften und in der Wiederholung der Woche allen davon erzählen.",NA,NA,NA,NA
NA,NA,NA,Destruktiv und gewalttätig sein.,"Mich selbst blind oder taub machen, um zu verstehen, wie es sich damit lebt.",Ungeschützten Geschlechtsverkehr mit Fremden haben.,Einer Sekte beitreten.,Den ganzen Tag schlafen.,"So tun, als wäre ich jemand anders.","Alles essen, was ich will.",Auftritte in allen Karaokebars der Stadt haben.,"Mich ganz normal verhalten aus Angst, dass sich die Zeit doch nicht zurückdreht.",NA,NA,NA
NA,NA,NA,Jemandem den schlimmsten Tag seines/ihres Lebens bescheren.,"Ein Kind kidnappen, um zu sehen wie es ist Eltern zu sein.","Etwas peinliches machen, das ich schon immer vorhatte.",Verbotene Orte aufsuchen.,"Herumfragen, was ich mit dieser Gelegenheit sinnvolles tun könnte.",Ich hätte Angst und würde mich zurückziehen.,Zeit für mich nehmen und alle sozialen Verpflichtungen ignorieren.,Mit Drogen experimentieren.,Übertrieben viel Geld für einen Reise ausgeben.,NA,NA,NA
NA,NA,Öffentliche Einrichtungen niederbrennen.,Eine Bank ausrauben und das ganze Geld ausgeben.,"Meine Rechnungen nicht bezahlen, um zu sehen, ob ich damit durchkomme.","Etwas beichten, was ich niemandem zuvor gesagt habe.",Jemanden heiraten.,Ich würde meine Liebe gestehen ohne Angst vor Zurückweisung.,Erotische Phantasien ausleben.,"Einfach machen, was mir spontan in den Sinn kommt.","Eine Person, auf die ich stehe, fragen, ob sie/er Sex haben will.",Eine neue Religion begründen und der/die Anführerin sein.,"Herausfinden, wer einen Unfall haben wird und versuchen ihn in der Wiederholung der Woche zu verhindern.",NA,NA
Jemanden umbringen.,Grand Theft Auto im wahren Leben: Luxusautos stehlen und mit ihnen durch die Gegend heizen.,Extremsportarten ausprobieren.,"Meinen eigenen Tod faken, um zu sehen, wie andere darauf reagieren.",Graffiti sprayen.,"Mich outen und sehen, wie meine Familie reagiert.","Ich nutze die extra Woche, um angestaute Arbeiten zu erledigen (an die ich mich erinnern kann).",Fremdgehen.,Aufhören diesen Q-Sort zu legen.,"Mich umbringen, um zu sehen, was nach dem Tod geschieht.","Jemandem eine Freude bereiten, auch wenn er/sie sich nicht daran erinnern wird.","Die einmalige Gelegenheit nutzen, dass sich das Universum wiederholt und ein quantenphysikalisches Experiment durchführen.",Mit meinem Wissen über die Zukunft ein paar lukrative Insiderhandel an der Börse planen.,"Wissenschaftlich beweisen, dass die Zeitschleife tatsächlich passiert ist.",Mir die Lotto-Ergebnisse merken.
